1	165	赤き岸、白き渚あれば、黒き岩、黄なる崖あり。	M197,0:3,LOC_NOM,赤き岸;M198,4:7,LOC_NOM,白き渚;M199,11:14,FAC_NOM,黒き岩;M200,15:19,FAC_NOM,黄なる崖
1	166	子美太白の才、東坡柳州の筆にあらずはいかむかこの光景を捕捉しえん。	
1	167	さてそれより塩竈神社にもうでて、もうこの碑、壺の碑前を過ぎ、芭蕉の辻につき、青葉の名城は日暮れたれば明日の見物となすべきつもりにて、知る人の許に行きける。	M201,6:10,LOC_NAME,塩竈神社;M202,16:21,FAC_NAME,もうこの碑;M203,22:26,LOC_NAME,壺の碑前;M204,30:34,LOC_NAME,芭蕉の辻;M205,38:43,FAC_NAME,青葉の名城
1	168	しおがまにてただの一銭となりければ、そを神にたてまつりて、	M206,0:4,LOC_NAME,しおがま
1	169	からからとからき浮世の塩釜でせんじつめたりふところの中	M207,11:13,LOC_NAME,塩釜
1	170	はらの町にて、	M208,0:4,LOC_NAME,はらの町
1	171	宮城野の萩の餅さえくえぬ身のはらのへるのを何と仙台	M209,0:3,LOC_NAME,宮城野;M210,23:25,LOC_NAME,仙台
1	172	二十日、朝、曇り。	
1	173	午前九時知る人をたずねしに、言葉の聞きちがえにて、いと知れにくかりければ、	
1	174	いそがずはまちがえまじを旅人のあとよりわかる路次のむだ道	M211,22:28,LINE_NOM,路次のむだ道
1	175	二十一日、この日もまた我が得べき筋の金を得ず、今しばらく待ちてよとの事に逗留と決しける。	
1	176	二十二日、同じく閑窓読書の他なし。	
1	177	二十三日、同じく。	
1	178	二十四日、同じく。	
1	179	二十五日、朝、基督教会堂に行きて説教をきく。	M212,7:12,FAC_NOM,基督教会堂
1	180	仏教もこの教も人の口より聞けば有難からずと思いぬ。	
1	181	二十六日、いかがなしけん頭痛烈しくしていかんともしがたし。	
1	182	二十七日、同じく頭痛す。	
1	183	二十八日、少許の金と福島までの馬車券とを得ければ、因循日を費さんよりは苦しくとも出発せんと馬車にて仙台を立ち、日なお暮れざるに福島に着きぬ。	M213,10:12,LOC_NAME,福島;M214,45:47,VEHICLE,馬車;M215,49:51,LOC_NAME,仙台;M216,63:65,LOC_NAME,福島
1	184	途中白石の町は往時民家の二階立てを禁じありしとかにて、うち見たるところ今なお巍然たる家無し。	M217,2:6,LOC_NAME,白石の町;M218,9:11,FAC_NOM,民家;M219,38:43,FAC_NOM,巍然たる家
1	185	片倉小十郎は面白き制を布きしものかな。	
1	186	福島にて問い質すに、郡山より東京までは鉄路既に通じて汽車の往復ある由なり。	M220,0:2,LOC_NAME,福島;M221,10:12,LOC_NAME,郡山;M222,14:16,LOC_NAME,東京;M223,19:21,LINE_NOM,鉄路;M224,26:28,VEHICLE,汽車
1	187	その乗券の価を問うにほとんど嚢中有るところと相同じければ、今宵この地に宿りて汽車賃を食い込み、明日また歩み明後日また歩み、いつまでも順送りに汽車へ乗れぬ身とならんよりは、苦しくとも夜を罩めて郡山まで歩み、明日の朝一番にて東京に到らん方極めて妙なり、身には邪熱あり足はなお痛めど、夜行をとらでは以後の苦みいよいよもって大ならむと、ついに草鞋穿きとなりて歩み出しぬ。	M225,31:34,DEICTIC,この地;M226,70:72,VEHICLE,汽車;M227,95:97,LOC_NAME,郡山;M228,110:112,LOC_NAME,東京
1	188	二本松に至れば、はや夜半ちかくして、市は祭礼のよしにて賑やかなれど、我が心の淋しさ云うばかりなし。	M229,0:3,LOC_NAME,二本松;M230,18:19,LOC_NOM,市
1	189	市を出はずるる頃より月明らかに前途を照しくるれど、同伴者も無くてただ一人、町にて買いたる餅を食いながら行く心の中いと悲しく、銭あらば銭あらばと思いつつようよう進むに、足の疲れはいよいよ甚しく、時には犬に取り巻かれ人に誰何せられて、辛くも払暁郡山に達しけるが、二本松郡山の間にては幾度か憩いけるに、初めは路の傍の草あるところに腰を休めなどせしも、次には路央に蝙蝠傘を投じてその上に腰を休むるようになり、ついには大の字をなして天を仰ぎつつ地上に身を横たえ、額を照らす月光に浴して、他年のたれ死をする時あらば大抵かかる光景ならんと、悲しき想像なんどを起すようなりぬ。	M231,0:1,LOC_NOM,市;M232,15:17,LINE_NOM,前途;M233,37:38,LOC_NOM,町;M234,120:122,LOC_NAME,郡山;M235,129:136,LOC_NAME,二本松郡山の間;M236,151:161,LOC_NOM,路の傍の草あるところ;M237,175:177,LOC_NOM,路央;M238,185:188,DEICTIC,その上;M239,217:219,UNCERTAIN,地上
1	190	二十九日、汽車の中に困悶して僅かに睡り、午後東京に辛くも着きぬ。	M240,5:7,VEHICLE,汽車;M241,22:24,LOC_NAME,東京
1	191	久しく見ざれば停車場より我が家までの間の景色さえ変りて、愴然たる感いと深く、父上母上の我が思いなしにやいたく老いたまいたる、祖母上のこの四五日前より中風とやらに罹りたまえりとて、身動きも得したまわず病蓐の上に苦しみいたまえるには、いよいよ心も心ならず驚き悲しみ、弟妹等の生長せるばかりにはやや嬉しき心地すれど、いたずらに齢のみ長じてよからぬことのみし出したる我が、今もなお往時ながらの阿蒙なるに慚愧の情身を責むれば、他を見るにつけこれにすら悲しさ増して言葉も出でず。	M242,7:10,FAC_NOM,停車場;M243,12:15,FAC_NOM,我が家
1	192	（明治二十年八月）	
